,id_entidad,preten_ind,ind,un_preten,valor_ini_ind,contraparte,convocados,convocantes,id_arb,extrae,par_entidad,consecutivo,cont_casos,interinst,orfeo,impacto,ep_convocante,tipo_conv,apoderado_convocante,ep_convocada,apoderado_convocado,ent_vinculadas,nit,nac_ter_int,rol_entidad,tipo_arb,exp_cam_com,ctr_arbitraje,mecanismo_sel_arb,arbitro_n,nombre_arbitro,nombre_secretario,idsecretario,estado_caso,instancia,etapa,sentido_lau,tipo_cond,valor_costas,tipo_arbitramento,nombre_ua,sector_ua,hechos
72,310,345126384480.4735,195,PESOS,222155359996.0,COMPAÑÍA DE ELECTRICIDAD DEL CAUCA S.A. E.S.P. NIT 900244467-8,SOINCO PROYECTOS LTDA  ,COMPAÑÍA DE ELECTRICIDAD DEL CAUCA S.A. E.S.P. NIT 900244467-8,310001-CEDELCA-12008-21,310,52,21.0,1,NO,20154050202112 / 20154050178332 / 20154051134762 / 20164050597862/ 20174050077222/ 20178000098332,MACROECONOMICO,NO,JURIDICA ,MONROY TORRES MARCELA DEL NIÑO JESUS,SI,DE VIVERO ARCINIEGAS FELIPE,CENTRALES ELECTRICAS DEL CAUCA S.A.-E.S.P.- CEDELCA|310|MINAS Y ENERGIA,891500025-2,NACIONAL,CONVOCADO,ARBITRAMENTO GENERAL,1903,"CENTRO DE ARBITRAJE, CONCILIACIÓN Y AMIGABLE COMPOSICIÓN DE LA CÁMARA DE COMERCIO DE BOGOTÁ",MUTUO ACUERDO,2.0,NOGUERA CALDERON RODRIGO FRANCISCO MANUEL,BARRIOS MORALES LAURA FERNANDA,39791207,TERMINADO POR LAUDO,RECURSO EXTRAORDINARIO,FALLO,DESFAVORABLE,,,GENERAL,CENTRALES ELÉCTRICAS DEL CAUCA S.A. E.S.P.,Sector Minas y Energía,"El día 15 de  mayo del año 2008 CEDELCA dio apertura al concurso público No. 001-CEDELCA-2008 con el objeto de seleccionar el Gestor especializado para la gestión, ampliación, rehabilitación y mantenimiento preventivo y correctivo  de la infraestructura  del servicio de distribución y comercialización de energía eléctrica en el Departamento del Cauca, el 27 de agosto del año 2008 CEC, bajo la modalidad de una promesa de sociedad futura y con sujeción a lo establecido en el pliego de condiciones presentó oferta dentro del concurso público No. 0001-CEDELCA-2008. el día 27 de julio de 2008, CEDELCA celebró con el consorcio APPLUS NORCONTROL- INVERSIONES un contrato de interventoría técnica administrativa. 
el día 12 agosto de 2009 cedelca remitió a CEC la comunicación No. 648980 con asunto "" terminación unilateral"" en ella CEDELCA alegaba la supuesta existencia de incumplimientos de interventoría, los cuales consideraba que justificaban la terminación unilateral del contrato de gestión1. LA SUPERINTENDENCIA DE SERVICIOS PÚBLICOS DOMICILIARIOS EN TOMA DE POSESIÓN DE CEDELCA FIJO UNOS PARAMETROS PARA EL PLAN DE SALVAMENTO DE CEDELCA, ENTRE EN LOS QUE SE ENCONTRÓ CEDELCA SELECCIONARÍA UN GESTOR ESPECIALIZADO PARA LA PRESTACIÓN DE LOS SERVICIOS DE DISTRIBUCIÓN Y COMERCIALIZACIÓN DE ENERGÍA EN EL DEPARTAMENTO DEL CAUCA. 2. MEDIANTE CONCURSO PÚBLICO No. 001 CEDELCA 2008, EL 17 DE SEPTIEMBRE DE 2007 CEDELCA ADJUDICO EL CONCURSO PÚBLICO A LA COMPAÑÍA DE ELECTRICIDAD DEL CAUCA. 3. EL 07 DE OCTUBRE DE 2008 SUSCRIBIO CEDELCA CON LA COMPAÑÍA DE ELECTRICIDAD DEL CAUCA CONTRATO DE GESTIÓN PARA LA AMPLIACIÓN, REHABILITACIÓN, MANTENIMIENTO, PREVENTIVO Y CORRECTIVO DE LA INFRAESTRUCTURA DEL SERVICIO Y DEMAS ACTIVIDADES, NECESARIA PARA LA PRESTACIÓN DEL SERVICIO DE DISTRIBUICIÓN Y COMERCIALIZACIÓN EN EL DEPARTAMENTO DEL CAUCA  DURANTE 20 AÑOS A PARTIR DEL 01 DE DICIEMBRE DE 2008. 4. CON FUNDAMENTO EN INFORMES DE LA INTERVENTORIA APPLUS NOR CONTROL  AL CONTRATO DE GESTIÓN Y LUEGO DE VARIOS REQUERIMIENTOS DE INFORMACIÓN POR PARTE DE CEDELCA A CEC SIN OBTENER RESPUESTAS SATISFACTORIA DE PARTE DE CEC, EL 09 DE SEPTIEMBRE DE 2009, EL AGENTE ESPECIAL DESIGNADO POR LA SUPERINTENDENCIA DE SERVICIOS PUBLICOS NOTIFICO A CEC LA DECISIÓN DE TERMINAR UNILATERALMENTE AL CONTRATO DE GESTIÓN, CON FUNDAMENTO EN LOS SIGUIENTES INCUMPLIMIENTOS CONTRATUACLES: A) NO RENOVACIÓN DE LAS PÓLIZAS MULTIRIESGO. B) INCUMPLIMIENTO DEL ANEXO TECNICO. C) NO PRESENTACIÓN DEL PLAN DE INVERSIÓN DETALLADO . D) NO PRESENTACIÓN DE INFORMACIÓN A LA INTERVENTORIA."
73,245,93737215751.29778,197,PESOS,82192783998.0,AUTOPISTAS DE LA SABANA SAS NIT 900135168-3,AGENCIA NACIONAL DE INFRAESTRUCTURA - ANI,AUTOPISTAS DE LA SABANA SAS NIT 900135168-3,245002-32007-,245,42,,0,NO,20184050351022/ 20181031262552/ 20188001263042/ 20184051262452/ 20188001319742/ 20188001468152/ 20188002028512/ 20188002412852/ 20188002299162 ,,NO,JURIDICA ,GARCIA MATAMOROS FERNANDO AUGUSTO,SI,GUTIERREZ RAMIREZ ALEJANDRO,AGENCIA NACIONAL DE INFRAESTRUCTURA - ANI|245|TRANSPORTE,830125996-6,NACIONAL,CONVOCADO,ARBITRAMENTO GENERAL,15597,"CENTRO DE ARBITRAJE, CONCILIACIÓN Y AMIGABLE COMPOSICIÓN DE LA CÁMARA DE COMERCIO DE BOGOTÁ",MUTUO ACUERDO,2.0,NOGUERA CALDERON RODRIGO FRANCISCO MANUEL,MORALES GIL DIEGO FERNANDO,79948494,TERMINADO POR LAUDO,PRIMERA ,FALLO,DESFAVORABLE,PAGAR,0,GENERAL,AGENCIA NACIONAL DE INFRAESTRUCTURA,Sector Transporte,
74,240,55488160327.235054,198,PESOS,38192725638.0,"SOCIEDAD KMA CONSTRUCCIONES S.A,TELEORINOQUÍA S.A E.S.P, CICON S.A, MIEMBROS DEL CONSORCIO TELECOMUNICACIONES DE COLOMBIA- CONTECOL  ",FONDO DE TECNOLOGIAS DE LA INFORMACION Y LAS COMUNICACIONES ,"SOCIEDAD KMA CONSTRUCCIONES S.A,TELEORINOQUÍA S.A E.S.P, CICON S.A, MIEMBROS DEL CONSORCIO TELECOMUNICACIONES DE COLOMBIA- CONTECOL  ",2404442008-38,240,61,38.0,1,NO,20154010066072,MACROECONOMICO,NO,JURIDICA ,HOYOS DUQUE RICARDO IGNACIO,SI,MAYORGA PATARROYO CARLOS FELIPE,FONDO DE TECNOLOGIAS DE LA INFORMACION Y LAS COMUNICACIONES |240|TECNOLOGIAS DE LA INFORMACION Y LAS COMUNICACIONES,800131648-6,NACIONAL,CONVOCADO,ARBITRAMENTO GENERAL,2512,"CENTRO DE ARBITRAJE, CONCILIACIÓN Y AMIGABLE COMPOSICIÓN DE LA CÁMARA DE COMERCIO DE BOGOTÁ",MUTUO ACUERDO,1.0,ESCOBAR GIL RODRIGO ALONSO,SANTOS RODRIGUEZ JORGE ENRIQUE,80088885,TERMINADO POR LAUDO,PRIMERA ,FALLO,DESFAVORABLE,PAGAR,0,GENERAL,FONDO DE TECNOLOGÍAS DE LA INFORMACIÓN Y LAS COMUNICACIONES,Sector de las Tecnologías de la Información y las Comunicaciones,"Dirimir las controversias surgidas entre las sociedades KMA CONSTRUCCIONES S.A., TELEORINOQUIA S.A. ESP y CICON S.A., integrantes del denominado CONSORCIO TELECOMUNICACIONES DE COLOMBIA – CONTECOL- y el FONDO DE TECNOLOGÍAS DE LA INFORMACIÓN Y LAS COMUNICACIONES – FONTIC, respecto al cumplimiento del Contrato de Fomento No. 00444 de 2008."
75,206,9437824574.593082,200,PESOS,6730299578.0,"VELANDOA LTDA HOY XIE S.A, EDIVIAL EU HOY EDIVIAL INGENIERIA SAS Y SEVILLA Y MARTINEZ INGENIEROS SEMAICA INTEGRANTES DEL CONSORCIO KUMBRE   ","VELANDOA LTDA HOY XIE S.A, EDIVIAL EU HOY EDIVIAL INGENIERIA SAS Y SEVILLA Y MARTINEZ INGENIEROS SEMAICA INTEGRANTES DEL CONSORCIO KUMBRE   ",FONDO FINANCIERO DE PROYECTOS DE DESARROLLO - FONADE,2062071792-22007-37,206,53,37.0,1,NO,20154051358252/ 20178000132892,JURIDICO,SI,JURIDICA ,ESTRADA SANCHEZ JUAN PABLO,NO,BOTERO REYES JENNIFER,FONDO FINANCIERO DE PROYECTOS DE DESARROLLO - FONADE|206|PLANEACION,899999316-1,NACIONAL,CONVOCANTE,ARBITRAMENTO GENERAL,2955,"CENTRO DE ARBITRAJE, CONCILIACIÓN Y AMIGABLE COMPOSICIÓN DE LA CÁMARA DE COMERCIO DE BOGOTÁ",MUTUO ACUERDO,1.0,ESCOBAR GIL RODRIGO ALONSO,RUEDA ORDOÑEZ LAURA MARCELA,63515847,TERMINADO POR LAUDO,PRIMERA ,FALLO,DESFAVORABLE,,0,INFRAESTRUCTURA,EMPRESA NACIONAL PROMOTORA DEL DESARROLLO TERRITORIAL,Sector Planeación,"Se pretende demostrar el incumplimiento del contrato de obra 20717192 suscrito por el CONSORCIO KUMBRE con el FONDO FINANCIERO DE PROYECTOS DE DESARROLLO - FONADE cuyo objeto es la construcción del establecimiento penitenciario de mediana seguridad y carcelario en Florencia - Caquetá, por lo tanto se pretende el pago del valor de la clausula penal pecuniaria pactada en la clausula decima del contrato ."
76,356,14415430513.003576,201,PESOS,11802067992.0,ORGANIZACIÓN CLINICA GENERAL DEL NORTE S.A. - CLINICA PEÑITAS S.A.S. - SOCIEDAD MEDICA CLINICA RIOHACHA S.A.S. NIT 890102768-5,FONDO DE PRESTACIONES SOCIALES DEL MAGISTERIO - FOMAG,ORGANIZACIÓN CLINICA GENERAL DEL NORTE S.A. - CLINICA PEÑITAS S.A.S. - SOCIEDAD MEDICA CLINICA RIOHACHA S.A.S. NIT 890102768-5,3561122-09-082014-465,356,53,465.0,1,NO,20164050660272 / 20168000800622 / 20168000830092 / 20164051358922 / 20168001375942 / 20168001377562 / 20168001685212 / 20164052093182 / 20174051817082/ 20174051922312,JURIDICO,NO,JURIDICA ,HERNANDEZ ORTIZ OSWALDO FRANCISCO,SI,  ,FONDO DE PRESTACIONES SOCIALES DEL MAGISTERIOS FOMAG|356|EDUCACION ,860525148-5,NACIONAL,CONVOCADO,ARBITRAMENTO GENERAL,4579,"CENTRO DE ARBITRAJE, CONCILIACIÓN Y AMIGABLE COMPOSICIÓN DE LA CÁMARA DE COMERCIO DE BOGOTÁ",MUTUO ACUERDO,2.0,DURAN BUSTOS RODRIGO ANTONIO,ATUESTA ORTIZ ANDREA,52451905,TERMINADO POR LAUDO,PRIMERA ,FALLO,FAVORABLE,NO HAY CONDENA,80.000.000,GENERAL,FONDO DE PRESTACIONES SOCIALES DEL MAGISTERIO,Sector Educación Nacional,"LA CONTROVERSIA SE GENERO POR EL DESCUENTO ILEGAL POR CONCEPTO DE LA CAPITALIZACIÓN DE AFILIADOS Y BENEFICIARIOS PUES SEGÚN EL FOMAG, ESOS AFILIADOS Y BENEFICIARIOS ERAN MULTIAFILIADOS SIMULTANEAMENTE EN EL REGIMEN DE EXCEPCIÓN DE SALUD DEL MAGISTERIO Y OTROS REGIMENES DEL SISTEMA DE SEGURIDAD SOCIAL EN SALUD, SUMA QUE LEGAL Y CONTRACTUALMENTE CORRESPONDIA A LAS PERSONAS JURIDICAS DEMANDANTES."
77,219,541731257.0800227,203,PESOS,389965017.0,HIDROTEC LTDA Y PONCE DE LEÓN INTEGRANTES DEL CONSORCIO INTER ICBF  ,INSTITUTO COLOMBIANO DE BIENESTAR FAMILIAR,HIDROTEC LTDA Y PONCE DE LEÓN INTEGRANTES DEL CONSORCIO INTER ICBF  ,2199802007-40,219,43,40.0,1,NO,20148001397232 / 20158000741522 / 20154051160352,JURIDICO,NO,JURIDICA ,NUMA MARIN MANZUR MICHEL,SI,MARQUEZ ROJAS JOAN SEBASTIAN,INSTITUTO COLOMBIANO DE BIENESTAR FAMILIAR|219|INCLUSION SOCIAL Y RECONCILIACION,899999239-2,NACIONAL,CONVOCADO,ARBITRAMENTO,3090,"CENTRO DE ARBITRAJE, CONCILIACIÓN Y AMIGABLE COMPOSICIÓN DE LA CÁMARA DE COMERCIO DE BOGOTÁ",SORTEO CENTRO,2.0,GAMBA POSADA ROBERTO GUILLERMO,NOSSA CORTES MARIA FERNANDA,52009242,TERMINADO POR LAUDO,PRIMERA,FALLO,DESFAVORABLE,PAGAR,27589732,GENERAL,INSTITUTO COLOMBIANO DE BIENESTAR FAMILIAR,Sector Inclusión Social y Reconciliación,"Entre las partes se celebró contrato cuyo objeto era adelantar la interventoría técnica y operativa y de control de calidad del contrato 894 de 2007 de concesión para la operación de las plantas de producción de alimentos de alto valor nutricional Bienestaria, al desarrollo de nuevos productos derivados de sus fórmulas y a la distribución de alimentos. el ICBF considera que los productos no garantizaban la calidad de la Bienestarina por tanto imponen una multa al concesionario. como consecuencia de lo anterior la parte convocante solicita la revocatoria de los efectos económicos de las multas y en su lugar procedan a tasar un justo monto de la misma."
78,243,2275761049.249589,205,PESOS,1650500000.0,TRANEXCO SA  ,SERVICIOS POSTALES NACIONALES S.A. 4-72,TRANEXCO SA  ,243512011-120,243,40,120.0,0,NO,20154050253332,JURIDICO,NO,JURIDICA ,TORRENTE BAYONA CESAR AUGUSTO,SI,MEZA ARMENTA HUBERTO JOSE,SERVICIOS POSTALES NACIONALES S.A. 4-72|243|TECNOLOGIAS DE LA INFORMACION Y LAS COMUNICACIONES,900062917-9,NACIONAL,CONVOCADO,ARBITRAMENTO GENERAL,3412,"CENTRO DE ARBITRAJE, CONCILIACIÓN Y AMIGABLE COMPOSICIÓN DE LA CÁMARA DE COMERCIO DE BOGOTÁ",SORTEO CENTRO,1.0,GAMBA POSADA ROBERTO GUILLERMO,MÜRRLE ROJAS ANNE MARIE,31970481,TERMINADO POR LAUDO,PRIMERA ,FALLO,DESFAVORABLE,PAGAR,52212800,GENERAL,SERVICIOS POSTALES NACIONALES S.A.,Sector de las Tecnologías de la Información y las Comunicaciones,"EL CONTRATO 051 DE 2011 CELEBRADO ENTRE SERVICIOS PASTALES NACIONALES S.A Y TRANEXCO S.A CONSAGRA: ""CLAUSULA DECIMA NOVENA, CONCILIACIÓN Y ARBITRAJE; TODAS LAS DIFERENCIAS QUE SE SUSCITEN ENTRE LAS PARTES CON MOTIVO DE LA VALIDEZ, EXISTENCIA, CELEBRACIÓN, INTERPRETACIÓN, ALCANCE O EJECUCIÓN, TERMINACIÓN Y LIQUIDACIÓN DEL PRESENTE CONTRATO O SOBRE LAS ESTIPULACIONES EN EL CONTENIDAS SE SOMETERÁN A LAS DISPOSICIONES DE LA LEY COLOMBIANA EN MATERIAL DE CONCILIACIÓN Y ARBITRAJE, TANTO TECNICO COMO JURÍDICA.  EN EL EVENTO DE PRESENTARSE DISCREPANCIAS ENTRE LAS PARTES RESPECTO A LA VALIDEZ, EXISTENCIA, CELEBRACIÓN, INTERPRETACIÓN, ALCANCE O EJECUCIÓN, TERMINACIÓN Y LIQUIDACIÓN DEL CONTRATO O DE LAS ESTIPULACIONES EN EL CONTENIDAS QUE PUEDAS SER RESUELTAS DIRECTAMENTE POR LOS REPRESENTANTES LEGALES DE LAS PARTES EN UN TERMINO PRUDENCIAL QUE NO EXCEDA DE SESENTA (60) DÍAS, LAS PARTE4S ACUERDAN Y ACEPTAN EXPRESAMENTE QUE EL CONFLICTO SERÁ SOLUCIONADO POR UN TRIBUNAL DE ARBITRAMENTO A TRAVES DEL PROCESO ARBITRAL ...""  DIFERENCIAS CONTRACTUALES DEBIDO A LA TERMINACIÓN  Y EJECUCIÓN DEL CONTRATO 051 DE 2011."
79,154,22195802671.001846,208,PESOS,14613422143.0,FUNDACION OFTALMOLOGICA DE SANTANDER- FOSCAL / CAJA SANTANDEREANA DE SUBSIDIO FAMILIAR- CAJASAN / CLINICA SANTA ANA SA / SOCIEDAD CLINICA VALLEDUPAR LTDA NIT 8902053614 / 890200106-1,FIDUCIARIA LA PREVISORA S.A. - FIDUPREVISORA,FUNDACION OFTALMOLOGICA DE SANTANDER- FOSCAL / CAJA SANTANDEREANA DE SUBSIDIO FAMILIAR- CAJASAN / CLINICA SANTA ANA SA / SOCIEDAD CLINICA VALLEDUPAR LTDA NIT 8902053614 / 890200106-1,1541122-14-082008-74,154,45,74.0,1,NO,20154050564252,JURIDICO,NO,JURIDICA ,  ,SI,  ,FIDUCIARIA LA PREVISORA S.A. - FIDUPREVISORA|154|HACIENDA Y CREDITO PUBLICO, 860525148-5,NACIONAL,CONVOCADO,ARBITRAMENTO GENERAL,2157,"CENTRO DE ARBITRAJE, CONCILIACIÓN Y AMIGABLE COMPOSICIÓN DE LA CÁMARA DE COMERCIO DE BOGOTÁ",,,RODRIGUEZ D´ALEMAN ROBERTO,SANABRIA SANTOS HENRY NORBERTO,79756899,TERMINADO POR LAUDO,PRIMERA ,FALLO,DESFAVORABLE,PAGAR,1220372248,GENERAL,FIDUCIARIA LA PREVISORA S.A.,Sector Hacienda y Crédito Público,"El día 10 de julio de 2008, la FIDUPREVISORA, actuando en su calidad de administradora de los recursos y vocera del patrimonio autónomo del FOMAG y según la orden de apertura de la convocatoria pública impartida el 4 de junio de 2008 por el Consejo Directivo del FOMAG, procedió a la apertura de la convocatoria pública- selección abreviada No. 001 de 2008 para la contratación de los servicios de salud para los afiliados y sus beneficiarios al FOMAG. El día 19 de agosto de 2009, el Consejo Directivo del FOMAG autorizó a la FIDUPREVISORA S.A, la contratación de un estudio por medio del cual se determinará la suficiencia de la UPCM, a efectos de soportar la toma de decisiones frente a los reajustes de la unidad de pago, para lo cual se llevó a cabo el proceso de selección abreviada de menor cuantía No. 002 de 2009, adjudicado a la firma CONSULTORES PROFESIONALES Y ACTUARIALES LTDA, mediante contrato No. 1122-07-2009. el día 18 de mayo de 2010 la UNION TEMPORAL AVANZAR MÉDICO REGION 1 mediante la comunicación DE 0330-10 dirigida a la doctora Piedad Mejía. Gerente de Servicios de Salud de FIDUPREVISORA S.A, informa de aspectos referentes a la alta siniestralidad que se estaban sufriendo en la ejecución del contrato. Por superar el límite establecido para acceder al reembolso de los recursos con los que se constituyó un encargo fiduciario que estaba orientado a cubrir las necesidades de liquidez por la desviación en los costos del IV nivel de atención, que correspondían al 17.78% de la UPCez, equivalente a un valor estimado en la capitación mensual de 8342121.982.00 mensuales, suma que se ha superado durante todos los meses del 2010, desde el 2010, de manera trimestral la UNION TEMPORAL AVANZAR MEDICO REGION 1, solicitó el reintegro de los recursos del encargado fiduciario, lo cual fue auditado y autorizado por la Gerencia de Salud de la FIDUPREVISORA. Por lo anterior la parte convocante solicita se declare que durante la ejecución del contrato para la prestación del servicios médico-asistenciales No. 1122-14-08 celebrado entre el FOMAG- FIDUPREVISORA S.A y la UNIÓN TEMPORAL AVANZAR MÉDICO REGIÓN 1, se presentó insufiencia integral en el valor de la Unidad de Pago por Capitación del Magisterio( UPCM) es decir que los ingresos por este concepto fueron inferiores a los costos incurridos por los demandantes, necesarios para atender y financiar el plan de atención en insuficiencia que se presentó en los años 2009,2010 y con posterioridad si la hubiere. así mismo se declare que por cuanto se presentó desequilibrio económico - financiero del contrato, se causó además por el incumplimiento del ente estatal de las estipulaciones previstas en el pliego de condiciones de la convocatoria pública- sección abreviada No. 001 de 2008."
80,356,22195802671.001846,209,PESOS,14613422143.0,FUNDACION OFTALMOLOGICA DE SANTANDER- FOSCAL / CAJA SANTANDEREANA DE SUBSIDIO FAMILIAR- CAJASAN / CLINICA SANTA ANA SA / SOCIEDAD CLINICA VALLEDUPAR LTDA NIT 8902053614 / 890200106-1,FONDO DE PRESTACIONES SOCIALES DEL MAGISTERIO - FOMAG,FUNDACION OFTALMOLOGICA DE SANTANDER- FOSCAL / CAJA SANTANDEREANA DE SUBSIDIO FAMILIAR- CAJASAN / CLINICA SANTA ANA SA / SOCIEDAD CLINICA VALLEDUPAR LTDA NIT 8902053614 / 890200106-1,3561122-14-082008-74,356,53,74.0,1,NO,20154050564252,JURIDICO,NO,JURIDICA ,  ,SI,  ,FONDO DE PRESTACIONES SOCIALES DEL MAGISTERIOS FOMAG|356|EDUCACION ,860525148-5,NACIONAL,CONVOCADO,ARBITRAMENTO GENERAL,2157,"CENTRO DE ARBITRAJE, CONCILIACIÓN Y AMIGABLE COMPOSICIÓN DE LA CÁMARA DE COMERCIO DE BOGOTÁ",,,RODRIGUEZ D´ALEMAN ROBERTO,SANABRIA SANTOS HENRY NORBERTO,79756899,TERMINADO POR LAUDO,PRIMERA ,FALLO,DESFAVORABLE,PAGAR,1220372248,GENERAL,FONDO DE PRESTACIONES SOCIALES DEL MAGISTERIO,Sector Educación Nacional,"El día 10 de julio de 2008, la FIDUPREVISORA, actuando en su calidad de administradora de los recursos y vocera del patrimonio autónomo del FOMAG y según la orden de apertura de la convocatoria pública impartida el 4 de junio de 2008 por el Consejo Directivo del FOMAG, procedió a la apertura de la convocatoria pública- selección abreviada No. 001 de 2008 para la contratación de los servicios de salud para los afiliados y sus beneficiarios al FOMAG. El día 19 de agosto de 2009, el Consejo Directivo del FOMAG autorizó a la FIDUPREVISORA S.A, la contratación de un estudio por medio del cual se determinará la suficiencia de la UPCM, a efectos de soportar la toma de decisiones frente a los reajustes de la unidad de pago, para lo cual se llevó a cabo el proceso de selección abreviada de menor cuantía No. 002 de 2009, adjudicado a la firma CONSULTORES PROFESIONALES Y ACTUARIALES LTDA, mediante contrato No. 1122-07-2009. el día 18 de mayo de 2010 la UNION TEMPORAL AVANZAR MÉDICO REGION 1 mediante la comunicación DE 0330-10 dirigida a la doctora Piedad Mejía. Gerente de Servicios de Salud de FIDUPREVISORA S.A, informa de aspectos referentes a la alta siniestralidad que se estaban sufriendo en la ejecución del contrato. Por superar el límite establecido para acceder al reembolso de los recursos con los que se constituyó un encargo fiduciario que estaba orientado a cubrir las necesidades de liquidez por la desviación en los costos del IV nivel de atención, que correspondían al 17.78% de la UPCez, equivalente a un valor estimado en la capitación mensual de 8342121.982.00 mensuales, suma que se ha superado durante todos los meses del 2010, desde el 2010, de manera trimestral la UNION TEMPORAL AVANZAR MEDICO REGION 1, solicitó el reintegro de los recursos del encargado fiduciario, lo cual fue auditado y autorizado por la Gerencia de Salud de la FIDUPREVISORA. Por lo anterior la parte convocante solicita se declare que durante la ejecución del contrato para la prestación del servicios médico-asistenciales No. 1122-14-08 celebrado entre el FOMAG- FIDUPREVISORA S.A y la UNIÓN TEMPORAL AVANZAR MÉDICO REGIÓN 1, se presentó insufiencia integral en el valor de la Unidad de Pago por Capitación del Magisterio( UPCM) es decir que los ingresos por este concepto fueron inferiores a los costos incurridos por los demandantes, necesarios para atender y financiar el plan de atención en insuficiencia que se presentó en los años 2009,2010 y con posterioridad si la hubiere. así mismo se declare que por cuanto se presentó desequilibrio económico - financiero del contrato, se causó además por el incumplimiento del ente estatal de las estipulaciones previstas en el pliego de condiciones de la convocatoria pública- sección abreviada No. 001 de 2008."
81,147,22195802671.001846,210,PESOS,14613422143.0,FUNDACION OFTALMOLOGICA DE SANTANDER- FOSCAL / CAJA SANTANDEREANA DE SUBSIDIO FAMILIAR- CAJASAN / CLINICA SANTA ANA SA / SOCIEDAD CLINICA VALLEDUPAR LTDA NIT 8902053614 / 890200106-1,MINISTERIO DE EDUCACIÓN NACIONAL,FUNDACION OFTALMOLOGICA DE SANTANDER- FOSCAL / CAJA SANTANDEREANA DE SUBSIDIO FAMILIAR- CAJASAN / CLINICA SANTA ANA SA / SOCIEDAD CLINICA VALLEDUPAR LTDA NIT 8902053614 / 890200106-1,1471122-14-082008-74,147,33,74.0,1,NO,20154050564252,JURIDICO,NO,JURIDICA ,  ,SI,  ,MINISTERIO DE EDUCACIÓN NACIONAL|147|EDUCACION ,899999001-7,NACIONAL,CONVOCADO,ARBITRAMENTO GENERAL,2157,"CENTRO DE ARBITRAJE, CONCILIACIÓN Y AMIGABLE COMPOSICIÓN DE LA CÁMARA DE COMERCIO DE BOGOTÁ",,,RODRIGUEZ D´ALEMAN ROBERTO,SANABRIA SANTOS HENRY NORBERTO,79756899,TERMINADO POR LAUDO,PRIMERA ,FALLO,DESFAVORABLE,PAGAR,1220372248,GENERAL,MINISTERIO DE EDUCACIÓN NACIONAL,Sector Educación Nacional,"El día 10 de julio de 2008, la FIDUPREVISORA, actuando en su calidad de administradora de los recursos y vocera del patrimonio autónomo del FOMAG y según la orden de apertura de la convocatoria pública impartida el 4 de junio de 2008 por el Consejo Directivo del FOMAG, procedió a la apertura de la convocatoria pública- selección abreviada No. 001 de 2008 para la contratación de los servicios de salud para los afiliados y sus beneficiarios al FOMAG. El día 19 de agosto de 2009, el Consejo Directivo del FOMAG autorizó a la FIDUPREVISORA S.A, la contratación de un estudio por medio del cual se determinará la suficiencia de la UPCM, a efectos de soportar la toma de decisiones frente a los reajustes de la unidad de pago, para lo cual se llevó a cabo el proceso de selección abreviada de menor cuantía No. 002 de 2009, adjudicado a la firma CONSULTORES PROFESIONALES Y ACTUARIALES LTDA, mediante contrato No. 1122-07-2009. el día 18 de mayo de 2010 la UNION TEMPORAL AVANZAR MÉDICO REGION 1 mediante la comunicación DE 0330-10 dirigida a la doctora Piedad Mejía. Gerente de Servicios de Salud de FIDUPREVISORA S.A, informa de aspectos referentes a la alta siniestralidad que se estaban sufriendo en la ejecución del contrato. Por superar el límite establecido para acceder al reembolso de los recursos con los que se constituyó un encargo fiduciario que estaba orientado a cubrir las necesidades de liquidez por la desviación en los costos del IV nivel de atención, que correspondían al 17.78% de la UPCez, equivalente a un valor estimado en la capitación mensual de 8342121.982.00 mensuales, suma que se ha superado durante todos los meses del 2010, desde el 2010, de manera trimestral la UNION TEMPORAL AVANZAR MEDICO REGION 1, solicitó el reintegro de los recursos del encargado fiduciario, lo cual fue auditado y autorizado por la Gerencia de Salud de la FIDUPREVISORA. Por lo anterior la parte convocante solicita se declare que durante la ejecución del contrato para la prestación del servicios médico-asistenciales No. 1122-14-08 celebrado entre el FOMAG- FIDUPREVISORA S.A y la UNIÓN TEMPORAL AVANZAR MÉDICO REGIÓN 1, se presentó insufiencia integral en el valor de la Unidad de Pago por Capitación del Magisterio( UPCM) es decir que los ingresos por este concepto fueron inferiores a los costos incurridos por los demandantes, necesarios para atender y financiar el plan de atención en insuficiencia que se presentó en los años 2009,2010 y con posterioridad si la hubiere. así mismo se declare que por cuanto se presentó desequilibrio económico - financiero del contrato, se causó además por el incumplimiento del ente estatal de las estipulaciones previstas en el pliego de condiciones de la convocatoria pública- sección abreviada No. 001 de 2008."
82,249,13580914135.678898,215,PESOS,9030463110.0,COMPAÑÍA DE DESARROLLO AEROPUERTO EL DORADO CODAD  ,COMPAÑÍA DE DESARROLLO AEROPUERTO EL DORADO CODAD  ,U.A.E. DE LA AERONAUTICA CIVIL,249010-OP1995-13,249,31,13.0,1,NO,20158000140572,JURIDICO,SI,JURIDICA ,ESGUERRA PORTOCARRERO JUAN CARLOS,NO ,MANTILLA PADILLA ALVARO,U.A.E. DE LA AERONAUTICA CIVIL|249|TRANSPORTE,830125996-6,NACIONAL,CONVOCANTE,ARBITRAMENTO GENERAL,2110,"CENTRO DE ARBITRAJE, CONCILIACIÓN Y AMIGABLE COMPOSICIÓN DE LA CÁMARA DE COMERCIO DE BOGOTÁ",MUTUO ACUERDO,2.0,HOYOS DUQUE RICARDO IGNACIO,DE LA TORRE BLANCHE CAMILA MARIA,51644214,TERMINADO POR LAUDO,PRIMERA ,FALLO,DESFAVORABLE,NO HAY CONDENA,NO HAY CONDENA,GENERAL,UNIDAD ADMINISTRATIVA ESPECIAL DE AERONÁUTICA CIVIL,Sector Transporte,Se declare que Codad S.A. ha incumplido aquellas obligaciones que asumió por virtud del Contrato No. 010-OP del 18 de julio de 1995 y que se señalan a continuación:
83,245,15625521764.597937,216,PESOS,10390000000.0,INTEGRANTES DEL CONSORCIO VÍA AL MAR  ,AGENCIA NACIONAL DE INFRAESTRUCTURA - ANI,INTEGRANTES DEL CONSORCIO VÍA AL MAR  ,2455031994-6,245,42,6.0,1,NO,20154050238872/ 20178000085412,JURIDICO,NO,JURIDICA ,RAMOS LOPEZ RUGERO EDUARDO,SI,PATIÑO DOMINGUEZ HECTOR EDUARDO,AGENCIA NACIONAL DE INFRAESTRUCTURA - ANI|245|TRANSPORTE,830125996-6,NACIONAL,CONVOCADO,ARBITRAMENTO GENERAL,2229,"CENTRO DE ARBITRAJE, CONCILIACIÓN Y AMIGABLE COMPOSICIÓN DE LA CÁMARA DE COMERCIO DE BOGOTÁ",MUTUO ACUERDO,3.0,HOYOS DUQUE RICARDO IGNACIO,AGUILAR DIAZ ROBERTO,79295439,TERMINADO POR LAUDO,PRIMERA ,FALLO,DESFAVORABLE,PAGAR,0,GENERAL,AGENCIA NACIONAL DE INFRAESTRUCTURA,Sector Transporte,LA DEMANDA HACE RELACIÓN A UN  INCUMPLIMIENTO DE LA AGENCIA EN EL PAGO DE OBRAS ADICIONALES
