,id_entidad,preten_ind,ind,un_preten,valor_ini_ind,contraparte,convocados,convocantes,id_arb,extrae,par_entidad,consecutivo,cont_casos,interinst,orfeo,impacto,ep_convocante,tipo_conv,apoderado_convocante,ep_convocada,apoderado_convocado,ent_vinculadas,nit,nac_ter_int,rol_entidad,tipo_arb,exp_cam_com,ctr_arbitraje,mecanismo_sel_arb,arbitro_n,nombre_arbitro,nombre_secretario,idsecretario,estado_caso,instancia,etapa,sentido_lau,tipo_cond,valor_costas,tipo_arbitramento,nombre_ua,sector_ua,hechos
194,61,25334003716.711468,670,PESOS,18343307593.81,BANCO AGRARIO DE COLOMBIA ,BANCO AGRARIO DE COLOMBIA ,FONDO PARA EL FINANCIAMIENTO DEL SECTOR AGROPECUARIO - FINAGRO,61|27 DE ENERO2014-212,61|,63,212.0,1,SI,20154050420032 / 20154051001202 / 20154051641892/ 20178000114432/ 20188001018052,JURIDICO,SI,JURIDICA ,PIQUERO VILLEGAS FELIPE,SI,GALLO MEDINA LUIS HERNANDO,FONDO PARA EL FINANCIAMIENTO DEL SECTOR AGROPECUARIO (FINAGRO)|61|AGRICULTURA Y DESARROLLO RURAL,,NACIONAL,CONVOCANTE,ARBITRAMENTO GENERAL,3390,"CENTRO DE ARBITRAJE, CONCILIACIÓN Y AMIGABLE COMPOSICIÓN DE LA CÁMARA DE COMERCIO DE BOGOTÁ",MUTUO ACUERDO,2.0,CARDENAS MEJIA JUAN PABLO,OTERO ALVAREZ LILIANA,52321113 ,TERMINADO POR LAUDO,PRIMERA ,FALLO,FAVORABLE,PAGAR,0,GENERAL,FONDO PARA EL FINANCIAMIENTO DEL SECTOR AGROPECUARIO,Sector Agricultura Pesquero y Desarrollo Rural,"1.- En el marco de la Resolución 5 de 2008 de la Comisión Nacional de Crédito Agropecuario, y sus respectivas modificaciones,  así como de lo previsto en circulares y el Manual de Servicios de Finagro, el Fondo Agropecuario de Garantías – FAG, de que tratan la Ley 16 de 1990 y la Ley 21 de 1985, administrado por FINAGRO, específicamente con cargo a la sub-cuenta Fondo de Garantías Especial de Exportadores, expidió varios certificados de garantía a  créditos de fomento agropecuario otorgados por el Banco Agrario de Colombia S.A. a favor de varias personas naturales y jurídicas.2.- Que respecto de varios de dichos certificados de garantía, existen controversias entre el Banco y FINAGRO respecto a la exigibilidad y procedencia o no del pago de algunos certificados negados, rechazados o inadmitidos por FINAGRO  o de aquellos ya efectuados por dicho Fondo, últimos de los cuales son objeto de solicitud de reembolso por Este al Banco Agrario de Colombia

"
195,249,,672,0,0.0,SOCIEDAD CONCESIONARIA OPERADORA AEROPORTUARIA INTERNACIONAL S.A. - OPAIN S.A.  ,SOCIEDAD CONCESIONARIA OPERADORA AEROPORTUARIA INTERNACIONAL S.A. - OPAIN S.A.  ,U.A.E. DE LA AERONAUTICA CIVIL,2496169OK2006-69,249,31,69.0,1,NO,,JURIDICO,SI,JURIDICA ,  ,,  ,U.A.E. DE LA AERONAUTICA CIVIL|249|TRANSPORTE,899999059-3,NACIONAL,CONVOCANTE,ARBITRAMENTO GENERAL,1988,"CENTRO DE ARBITRAJE, CONCILIACIÓN Y AMIGABLE COMPOSICIÓN DE LA CÁMARA DE COMERCIO DE BOGOTÁ",MUTUO ACUERDO,1.0,CARDENAS MEJIA JUAN PABLO,ZULETA GARCIA MARIA PATRICIA,39695351,TERMINADO POR LAUDO,PRIMERA ,FALLO,FAVORABLE,,0,GENERAL,UNIDAD ADMINISTRATIVA ESPECIAL DE AERONÁUTICA CIVIL,Sector Transporte,"LA PARTE CONVOCANTE SOLICITA NO LE SEA COBRADA LA SUMA DE DINERO, POR CONCEPTO DE MULTA POR INCUMPLIMIENTO EN LO PACTADO EN EL CONTRATO."
196,245,109629969513.50742,679,PESOS,93285186586.0,CSS CONSTRUCTORES S.A NIT 832006599-5,AGENCIA NACIONAL DE INFRAESTRUCTURA - ANI,CSS CONSTRUCTORES S.A NIT 832006599-5,2450377-12002-,245,42,,1,NO,20174051312142/ 20174051355252/ 20174051973212 / 20194050885452,MACROECONOMICO,NO,JURIDICA ,MIER BARROS PATRICIA EUGENIA,SI,DE VEGA PINZON GABRIEL,AGENCIA NACIONAL DE INFRAESTRUCTURA - ANI|245|TRANSPORTE,830125996-6,NACIONAL,CONVOCADO,ARBITRAMENTO GENERAL,5286,"CENTRO DE ARBITRAJE, CONCILIACIÓN Y AMIGABLE COMPOSICIÓN DE LA CÁMARA DE COMERCIO DE BOGOTÁ",MUTUO ACUERDO,3.0,CARDENAS MEJIA JUAN PABLO,GARAVITO VALENCIA PEDRO ORLANDO,,TERMINADO POR LAUDO,PRIMERA ,FALLO,DESFAVORABLE,PAGAR,0,GENERAL,AGENCIA NACIONAL DE INFRAESTRUCTURA,Sector Transporte,"EL CONVOCANTE ADUCE UN DESEQUILIBRIO ECONÓMICO DADO EL INCUMPLIMIENTO DE LA OBLIGACIÓN CONTENIDA EN LA CLAÚSULA 18,3 DEL CONTRATO DE CONCESIÓN POR PARTE  DE LA ANI "
197,154,23380496311.29913,686,PESOS,21351271896.0,CORPORACION DE SERVICIOS MEDICOS INTERNACIONALES THEM Y CIA LTDA COSMITET LTDA NIT 830023202-1,FIDUCIARIA LA PREVISORA S.A. - FIDUPREVISORA,CORPORACION DE SERVICIOS MEDICOS INTERNACIONALES THEM Y CIA LTDA COSMITET LTDA NIT 830023202-1,15412076-005-20122012-,154,45,,1,NO, 20194052191832/ 20198002270082,JURIDICO,NO,NATURAL,IBAÑEZ PARRA OSCAR,SI,SUAREZ  CALDERON JUAN PABLO,FIDUCIARIA LA PREVISORA S.A. - FIDUPREVISORA|154|HACIENDA Y CREDITO PUBLICO,860525148-5,NACIONAL,CONVOCADO,ARBITRAMENTO GENERAL,117072,"CENTRO DE ARBITRAJE, CONCILIACIÓN Y AMIGABLE COMPOSICIÓN DE LA CÁMARA DE COMERCIO DE BOGOTÁ",MUTUO ACUERDO,1.0,CARDENAS MEJIA JUAN PABLO,ZULETA GARCIA MARIA PATRICIA,39695351,TERMINADO POR LAUDO,PRIMERA ,FALLO,DESFAVORABLE,PAGAR,,GENERAL,FIDUCIARIA LA PREVISORA S.A.,Sector Hacienda y Crédito Público,"LAS PARTES SUSCRIBIERON CONTRATO PARA LA PRESTACIÓN DE SERVICIOS DE SALUD, PARA LOS AFILIADOS AL MAGISTERIO. 2. LA PARTE CONVOCANTE MANIFESTÓ QUE LA ENTIDAD INCUMPLIÓ EL CONTRATO,POR EL NO PAGO DE LOS RECOBROS DE ALTO COSTO."
198,249,,689,0,0.0,SOCIEDAD CONCESIONARIA OPERADORA AEROPORTUARIA INTERNACIONAL S.A. - OPAIN S.A. NIT  ,U.A.E. DE LA AERONAUTICA CIVIL,SOCIEDAD CONCESIONARIA OPERADORA AEROPORTUARIA INTERNACIONAL S.A. - OPAIN S.A. NIT  ,2496169OK-12006-69,249,31,69.0,1,NO,,JURIDICO,NO,JURIDICA ,  ,SI,  ,U.A.E. DE LA AERONAUTICA CIVIL|249|TRANSPORTE,899999059-3,NACIONAL,CONVOCADO,ARBITRAMENTO GENERAL,1332,"CENTRO DE ARBITRAJE, CONCILIACIÓN Y AMIGABLE COMPOSICIÓN DE LA CÁMARA DE COMERCIO DE BOGOTÁ",MUTUO ACUERDO,1.0,CARDENAS MEJIA JUAN PABLO,ZULETA GARCIA MARIA PATRICIA,39695351,TERMINADO POR LAUDO,PRIMERA ,FALLO,FAVORABLE,NO HAY CONDENA,0,GENERAL,UNIDAD ADMINISTRATIVA ESPECIAL DE AERONÁUTICA CIVIL,Sector Transporte,LA PARTE CONVOCANTE SOLICITA QUE SE DECLARE QUE NO ESTÁ OBLIGADO AL PAGO DE LOS INTERESES MORATORIOS DE LA CONTRAPRESTACIÓN DEFINIDA POR EL AMIGABLE COMPONEDOR Y QUE ES IMPROCEDENTE LA MULTA PREVISTA POR LA INTERVENTORÍA.
199,356,1576879447.5317743,695,PESOS,1202844586.0,UNION TEMPORAL MEDICOL SALUD 2012  ,FONDO DE PRESTACIONES SOCIALES DEL MAGISTERIO - FOMAG,UNION TEMPORAL MEDICOL SALUD 2012  ,35612076-003-20122012-229,356,53,229.0,1,NO,20154050855452 / 20164050096222 / 20164050569662 / 20164050720062 / 20164051200852 / 20164051689672 / 20164052010902/ 20178000055632/ 20178000207302/ 20178000236252/ 20178000405942/ 20178000437432/ 20178000480522/ 20178001123942/ 20178001081962/ 20178001138762/ 20178001701322/ 20178001730072/ 20178002138632,JURIDICO,NO,JURIDICA ,LOZANO CHAPARRO‎ CHRISTIAN CAMILO,SI ,VEGA PRECIADO HENRY,FONDO DE PRESTACIONES SOCIALES DEL MAGISTERIOS FOMAG|356|EDUCACION ,860525148-5,NACIONAL,CONVOCADO,ARBITRAMENTO GENERAL,4036,"CENTRO DE ARBITRAJE, CONCILIACIÓN Y AMIGABLE COMPOSICIÓN DE LA CÁMARA DE COMERCIO DE BOGOTÁ",SORTEO CENTRO,1.0,ALMONACID SANCHEZ JUAN MANUEL,RUGELES MARTINEZ MONICA FERNANDA,52256686,TERMINADO POR LAUDO,PRIMERA ,FALLO,FAVORABLE,NO HAY CONDENA,61000000,GENERAL,FONDO DE PRESTACIONES SOCIALES DEL MAGISTERIO,Sector Educación Nacional,"El día 30 de abril de 2012, en atención a la recomendación impartida por el Consejo Directivo del Fondo Nacional de prestaciones Sociales del Magisterio, la Fiduciaria Previsora S.A, suscribió contrato de prestación de servicios médico asistenciales con la Unión Temporal Medicol Salud 2012, cuyo objeto contractual fue garantizar la prestación de los servicios de salud para los afiliados al FOMAG y sus beneficiarios, zonificados en la región 2 integrada por los departamentos del Amazonas, Vichada, Guanía, Vaupés, Guaviare, Bogotá, Casanare, Meta, Cundinamarca y Tolima de acuerdo a las condiciones jurídicas, financieras y técnicas definidas en el pliego de condiciones y en la propuesta presentada por el contratista. Como consecuencia de lo anterior la parte convocante solicita la declaratoria de la nulidad de las resoluciones No. 2460,7842 y 10969 de 2014 expedidas por el Ministerio de Educación mediante el cual se impuso multa."
200,147,1576879447.5317743,696,PESOS,1202844586.0,UNION TEMPORAL MEDICOL SALUD 2012  ,MINISTERIO DE EDUCACIÓN NACIONAL,UNION TEMPORAL MEDICOL SALUD 2012  ,14712076-003-20122012-229,147,33,229.0,1,NO,20154050855452 / 20164050096222 / 20164050569662 / 20164050720062 / 20164051200852 / 20164051689672 / 20164052010902/ 20178000055632/ 20178000207302/ 20178000236252/ 20178000405942/ 20178000437432/ 20178000480522/ 20178001123942/ 20178001081962/ 20178001138762/ 20178001701322/ 20178001730072/ 20178002138632,JURIDICO,NO,JURIDICA ,LOZANO CHAPARRO‎ CHRISTIAN CAMILO,SI ,ORTEGON PULIDO CARLOS FELIPE,MINISTERIO DE EDUCACIÓN NACIONAL|147|EDUCACION ,899999001-7,NACIONAL,CONVOCADO,ARBITRAMENTO GENERAL,4036,"CENTRO DE ARBITRAJE, CONCILIACIÓN Y AMIGABLE COMPOSICIÓN DE LA CÁMARA DE COMERCIO DE BOGOTÁ",SORTEO CENTRO,1.0,ALMONACID SANCHEZ JUAN MANUEL,RUGELES MARTINEZ MONICA FERNANDA,52256686,TERMINADO POR LAUDO,PRIMERA ,FALLO,FAVORABLE,NO HAY CONDENA,61000000,GENERAL,MINISTERIO DE EDUCACIÓN NACIONAL,Sector Educación Nacional,"El día 30 de abril de 2012, en atención a la recomendación impartida por el Consejo Directivo del Fondo Nacional de prestaciones Sociales del Magisterio, la Fiduciaria Previsora S.A, suscribió contrato de prestación de servicios médico asistenciales con la Unión Temporal Medicol Salud 2012, cuyo objeto contractual fue garantizar la prestación de los servicios de salud para los afiliados al FOMAG y sus beneficiarios, zonificados en la región 2 integrada por los departamentos del Amazonas, Vichada, Guanía, Vaupés, Guaviare, Bogotá, Casanare, Meta, Cundinamarca y Tolima de acuerdo a las condiciones jurídicas, financieras y técnicas definidas en el pliego de condiciones y en la propuesta presentada por el contratista. Como consecuencia de lo anterior la parte convocante solicita la declaratoria de la nulidad de las resoluciones No. 2460,7842 y 10969 de 2014 expedidas por el Ministerio de Educación mediante el cual se impuso multa."
201,245,180548504959.38425,698,PESOS,138661947014.0,CONCESIÓN AUTOPISTA BOGOTÁ GIRARDOT S.A.  ,AGENCIA NACIONAL DE INFRAESTRUCTURA - ANI,CONCESIÓN AUTOPISTA BOGOTÁ GIRARDOT S.A.  ,24540-32004-231,245,42,231.0,0,NO,20154051000452 /20154051185792 / 20154051455812 / 20154051636652 / 20158001645282 / 20168000241012/ 20174050562882/ 20184050637482,MACROECONOMICO,NO,JURIDICA ,MONROY TORRES MARCELA DEL NIÑO JESUS,SI,GUTIERREZ RAMIREZ ALEJANDRO,AGENCIA NACIONAL DE INFRAESTRUCTURA - ANI|245|TRANSPORTE,830125996-6,NACIONAL,CONVOCADO,ARBITRAMENTO GENERAL,4150,"CENTRO DE ARBITRAJE, CONCILIACIÓN Y AMIGABLE COMPOSICIÓN DE LA CÁMARA DE COMERCIO DE BOGOTÁ",MUTUO ACUERDO,1.0,GARRIDO DIAZ JUAN MANUEL,ACEVEDO REHBEIN ALBERTO,79982607,TERMINADO POR LAUDO,PRIMERA ,FALLO,FAVORABLE,NO HAY CONDENA,0,GENERAL,AGENCIA NACIONAL DE INFRAESTRUCTURA,Sector Transporte,"La concesión Autopista Bogotá - Girardot S.A. y el entonces INCO, hoy ANI, suscribieron contrato de concesión No. Gg-040-2004 el cual tuvo como objeto el otorgamiento de una concesión a la CABG, con el fin de que la CABG realizara, de forma general, los estudios y diseños definitivos del proyecto vial ""Bosa-Granada-Girardot"" , la adquisición de predios, la ejecución de las obras de construcción y rehabilitación, la operación y mantenimientos de dichas obras, la financiación , la prestación de servicios y el uso de los bienes de propiedad del INCO dados en concesión, para la ejecución del mencionado proyecto. la controversia se genero debido a que la ANI, incumplió sus obligaciones contractuales, al no trasladar de manera integral a la subcuenta principal del patrimonio autónomo las sumas correspondientes a las vigencias fiscales pactadas en el adicional 1 al Contrato GG-040-2004, correspondientes a los años 2014 y 2015 y derivadas del compes 3632 del 16 de diciembre de 2009."
202,245,400000000.0,700,SALARIOS MINIMOS MENSUALES,400.0,OLEODUCTO CENTRAL S.A.,AGENCIA NACIONAL DE INFRAESTRUCTURA - ANI,OLEODUCTO CENTRAL S.A.,2450161996-443,245,42,443.0,1,SI,20154051912372 / 20164050515882 / 20164050740782 / 20164050785722 / 20164050821262 / 20168000821372 / 20168001482552,JURIDICO,SI,JURIDICA ,MUTIS TELLEZ FELIPE,SI,ESTRADA SANCHEZ JUAN PABLO,AGENCIA NACIONAL DE INFRAESTRUCTURA - ANI|245|TRANSPORTE,830125996-6,NACIONAL,CONVOCADO,ARBITRAMENTO GENERAL,4477,"CENTRO DE ARBITRAJE, CONCILIACIÓN Y AMIGABLE COMPOSICIÓN DE LA CÁMARA DE COMERCIO DE BOGOTÁ",MUTUO ACUERDO,3.0,GARRIDO DIAZ JUAN MANUEL,MANTILLA ESPINOSA FABRICIO,91075609,TERMINADO POR LAUDO,PRIMERA ,FALLO,FAVORABLE,NO HAY CONDENA,1264742024,GENERAL,AGENCIA NACIONAL DE INFRAESTRUCTURA,Sector Transporte,"QUE DE CONFORMIDAD CON LO ESTIPULADO EN LA CLAUSULA TERCERA DEL OTRO SI No.2 se declare que la metodología para el calculo de la contraprestación portuaria establecida en el documento CONPES 3744 de 2013 no le es aplicable al contrato de concesión portuaria No.16 de 1996 hasta tanto no se modifique el mismo sustancialmente, por esto se declare que no hay lugar a que la ANI recalcule la contraprestación portuaria a cargo de OCENSA con base en la metodología establecida en el documento CONPES antes dicho."
203,485,400000000.0,701,SALARIOS MINIMOS MENSUALES,400.0,AGENCIA NACIONAL DE INFRAESTRUCTURA - ANI,AGENCIA NACIONAL DE INFRAESTRUCTURA - ANI,OLEODUCTO CENTRAL S.A.,4850161996-443,485,23,443.0,1,SI,20154051912372 / 20164050515882 / 20164050740782 / 20164050785722 / 20164050821262 / 20168000821372 / 20168001482552,JURIDICO,SI,JURIDICA ,MUTIS TELLEZ FELIPE,SI,ESTRADA SANCHEZ JUAN PABLO,OLEODUCTO CENTRAL S.A.|485|MINAS Y ENERGIA,800251163-8,NACIONAL,CONVOCANTE,ARBITRAMENTO GENERAL,4477,"CENTRO DE ARBITRAJE, CONCILIACIÓN Y AMIGABLE COMPOSICIÓN DE LA CÁMARA DE COMERCIO DE BOGOTÁ",MUTUO ACUERDO,3.0,GARRIDO DIAZ JUAN MANUEL,MANTILLA ESPINOSA FABRICIO,91075609,TERMINADO POR LAUDO,PRIMERA ,FALLO,DESFAVORABLE,NO HAY CONDENA,1.264.742.024,GENERAL,OLEODUCTO CENTRAL S.A.,Sector Minas y Energía,"QUE DE CONFORMIDAD CON LO ESTIPULADO EN LA CLAUSULA TERCERA DEL OTRO SI No.2 se declare que la metodología para el calculo de la contraprestación portuaria establecida en el documento CONPES 3744 de 2013 no le es aplicable al contrato de concesión portuaria No.16 de 1996 hasta tanto no se modifique el mismo sustancialmente, por esto se declare que no hay lugar a que la ANI recalcule la contraprestación portuaria a cargo de OCENSA con base en la metodología establecida en el documento CONPES antes dicho."
204,487,36244032673.61131,706,PESOS,29639919300.0,SCHRADER CAMARGO INGENIEROS ASOCIADOS S.A. NIT 900112515-7,REFINERIA DE CARTAGENA S.A.,SCHRADER CAMARGO INGENIEROS ASOCIADOS S.A. NIT 900112515-7,487OFERTA MERCANTIL IRREVOCABLE No.13-01-022013-434,487,28,434.0,1,NO,20154051641632 / 20154051658262 / 20164051070272 / 20164051227592 / 20164051337242 / 20164051332732 / 20164051337222 / 20164051881082/ 20174051352462/ 20174051352472/ 20174051355912/ 20174051356082/ 20174051356732/ 20174051357002/ 20174051357302,JURIDICO,NO,CONVOCADO,BENAVIDES GALVIS CLAUDIA INES,SI,POSSE VELASQUEZ DANIEL,REFINERIA DE CARTAGENA S.A.|487|MINAS Y ENERGIA,900112515-7,NACIONAL,CONVOCADO,ARBITRAMENTO GENERAL,4371,"CENTRO DE ARBITRAJE, CONCILIACIÓN Y AMIGABLE COMPOSICIÓN DE LA CÁMARA DE COMERCIO DE BOGOTÁ",MUTUO ACUERDO,2.0,GARRIDO DIAZ JUAN MANUEL,CRESPO RIOS LYDA MERCEDES,29434956,TERMINADO POR LAUDO,PRIMERA ,FALLO,DESFAVORABLE,PAGAR,367000000,GENERAL,REFINERÍA DE CARTAGENA S.A.S,Sector Minas y Energía,"con la existencia de la oferta mercantil 24, el convocado incumplio el negocio juridico, el incumplimiento se evidención con la no ejecución de la totalidad de las obras señaladas en el contrato, como consecuencia de lo anterio la convocante debio contrastar otra empresa para que realizara la labor previamente contratada con la convocada"
205,442,1179836193.3055303,711,PESOS,1081291046.0,GRAN ESTACIÓN II CENTRO COMERCIAL P.H. NIT 9004823046,GRAN ESTACIÓN II CENTRO COMERCIAL P.H. NIT 9004823046,SOCIEDAD DE ACTIVOS ESPECIALES S.A.S|442|INTERIOR,442DEPOSITO2016-,442,37,,1,NO, 20194052055542/ 20194052336802/ 20194052398842/20194052511532/ 20194052636432 / 20204050985382 / 20204051013602,JURIDICO,SI,JURIDICA ,CABALLERO CABALLERO CABALLERO,NO,SALAZAR LOPEZ LUIS FERNANDO,SOCIEDAD DE ACTIVOS ESPECIALES S.A.S|442|HACIENDA Y CREDITO PUBLICO,900265408,NACIONAL,CONVOCANTE,ARBITRAMENTO GENERAL,115919,"CENTRO DE ARBITRAJE, CONCILIACIÓN Y AMIGABLE COMPOSICIÓN DE LA CÁMARA DE COMERCIO DE BOGOTÁ",SORTEO CENTRO,1.0,JUAN MANUEL GARRIDO DIAZ,CIFUENTES ALBADAN IVAN HUMBERTO,80273114,TERMINADO POR LAUDO,PRIMERA ,FALLO,FAVORABLE,,,GENERAL,SOCIEDAD DE ACTIVOS ESPECIALES S.A.S.,Sector Hacienda y Crédito Público,LA ENTIDAD CONVOCANTE MANIFIESTA QUE LA PARTE CONVOCADA INCUMPLIÓ SUS FUNCIONES DE ADMINISTRAR LOS BIENES Y ÁREAS COMUNES QUE HACEN PARTE DEL EDIFICIO DE OFICINAS DE PROPIEDAD DE LA CONVOCANTE. 2. LA ENTIDAD SOLICITA SE REALICE LA RESTITUCIÓN DE LOS COSTOS DE ADMINISTRACIÓN EN LOS QUE INCURRIÓ.
206,535,564486204.2468373,720,PESOS,391878501.0,ECO SYSTEMS LTDA NIT  900054592-5,ECO SYSTEMS LTDA NIT  900054592-5,EMPRESA DE TELECOMUNICACIONES DE BUCARAMANGA S.A. E.S.P. - TELEBUCARAMANGA,5352007000522007-29,535,75,29.0,1,NO,20154050192382,JURIDICO,SI,JURIDICA ,VELEZ OCHOA RICARDO,NO,MEJIA CAMACHO HERNANDO DE JESUS,EMPRESA DE TELECOMUNICACIONES DE BUCARAMANGA S.A. E.S.P. - TELEBUCARAMANGA|535|TECNOLOGIAS DE LA INFORMACION Y LAS COMUNICACIONES,890201210-2,NACIONAL,CONVOCANTE,ARBITRAMENTO GENERAL,2812,"CENTRO DE ARBITRAJE, CONCILIACIÓN Y AMIGABLE COMPOSICIÓN DE LA CÁMARA DE COMERCIO DE BOGOTÁ",MUTUO ACUERDO,3.0,GAMBOA BERNATE JUAN FERNANDO,RUGELES MARTINEZ MONICA FERNANDA,52256686,TERMINADO POR LAUDO,RECURSO EXTRAORDINARIO,FALLO,FAVORABLE,PAGAR,29.661.962‬,GENERAL,EMPRESA DE TELECOMUNICACIONES DE BUCARAMANGA S.A E.S.P,Sector de las Tecnologías de la Información y las Comunicaciones,INCUMPLIMIENTO DEL CONTRATO CUYO OBJETO ES LA COMPRAVENTA DE UNA SOLUCION PARA LA PRESTACION DE SERVICIOS DE FILTRADO DE CONTENIDO ANTISPAM & ANTIVIRUS Y FIREWALL DE PROTOCOLOS PARA LOS USUARIOS DE INTERNET CONMUTADO Y DEDICADO DE TELEBUCARAMANGA
207,554,186631529.2879061,726,PESOS,128040000.0,PROYECTAR VALORES S.A COMISIONISTA DE BOLSA EN LIQUIDACIÓN  ,PROYECTAR VALORES S.A COMISIONISTA DE BOLSA EN LIQUIDACIÓN  ,CAJA DE COMPENSACION FAMILIAR CAMPESINA- COMCAJA,554ENCARGO 458192008-19,554,49,19.0,1,NO,20154050198212,JURIDICO,SI,JURIDICA ,RAMOS ALARCON MAIRA,NO,MENESES VELOSA RENE WILSON,CAJA DE COMPENSACION FAMILIAR CAMPESINA- COMCAJA|554|AGRICULTURA Y DESARROLLO RURAL,800231969-4,NACIONAL,CONVOCANTE,ARBITRAMENTO GENERAL,2415,"CENTRO DE ARBITRAJE, CONCILIACIÓN Y AMIGABLE COMPOSICIÓN DE LA CÁMARA DE COMERCIO DE BOGOTÁ",SORTEO CENTRO ,1.0,GUASCA CAMARGO JUAN CARLOS,OTERO ALVAREZ LILIANA,52321113 ,TERMINADO POR LAUDO,PRIMERA ,FALLO,FAVORABLE,PAGAR,0,GENERAL,CAJA DE COMPENSACIÓN FAMILIAR CAMPESINA- COMCAJA,Sector Agricultura Pesquero y Desarrollo Rural,"Mediante el contrato Encargo No. 45819 de 2008 suscrito entre COMCAJA y PROYECTAR VALORES mediante el cual se pretende ejercer a nombre y por cuenta de COMCAJA , los derechos de cobro de rendimientos, cobro de capital, reinversión del capital y/o rendimientos, salvo especificación en contrario, y suscripción preferencial de los títulos que le correspondan,  la pretensión principal radica en el reintegro de manera inmediata las sumas correspondientes al cobro de lo no debido que resulte probado y el pago de los saldos a su favor producto de la rendición de cuentas de la gestión."
208,246,5177835029.497039,732,PESOS,3508659971.0,"CONSORCIO VALLE DEL CAUCA CONFORMADO POR PUCALPA CONSTRUCCIONES, LTDA. y ENTRE OBRAS S.AS.  ",INSTITUTO NACIONAL DE VIAS - INVIAS,"CONSORCIO VALLE DEL CAUCA CONFORMADO POR PUCALPA CONSTRUCCIONES, LTDA. y ENTRE OBRAS S.AS.  ",24624902005-51,246,36,51.0,1,NO,"20154050259282/
20178000044972",JURIDICO,NO,JURIDICA ,TORRES VEGA IRMA SOLANGEL,SI,ROA ESPINOSA JOSE OCTAVIO,INSTITUTO NACIONAL DE VIAS - INVIAS|246|TRANSPORTE,800215807-2,NACIONAL,CONVOCADO,ARBITRAMENTO GENERAL,2408,"CENTRO DE ARBITRAJE, CONCILIACIÓN Y AMIGABLE COMPOSICIÓN DE LA CÁMARA DE COMERCIO DE BOGOTÁ",MUTUO ACUERDO,1.0,EXPOSITO VELEZ JUAN CARLOS,COVILLA MARTINEZ JUAN CARLOS,,TERMINADO POR LAUDO,PRIMERA,FALLO,FAVORABLE,NO HAY CONDENA,0,INFRAESTRUCTURA,INSTITUTO NACIONAL DE VÍAS,Sector Transporte,"DESEQUILIBRIO ECONÓMICO, STAND BY DE PERSONAL, STAND BY DE MAQUINARIA Y MAYORES CANTIDADES DE OBRA"
209,246,4965748225.694764,734,PESOS,3423529661.0,C.I. GRODCO S EN C.A. INGENIEROS CIVILES NIT 860506688-1,INSTITUTO NACIONAL DE VIAS - INVIAS,C.I. GRODCO S EN C.A. INGENIEROS CIVILES NIT 860506688-1,24612402005-44,246,36,44.0,1,NO,20154050259282 / 20158000651102/ 20178000044972,JURIDICO,NO,JURIDICA ,TORRES VEGA IRMA SOLANGEL,SI,MOLANO VILLATE JANETH PATRICIA,INSTITUTO NACIONAL DE VIAS - INVIAS|246|TRANSPORTE,800215807-2,NACIONAL,CONVOCADO,ARBITRAMENTO GENERAL,2709,"CENTRO DE ARBITRAJE, CONCILIACIÓN Y AMIGABLE COMPOSICIÓN DE LA CÁMARA DE COMERCIO DE BOGOTÁ",MUTUO ACUERDO,3.0,EXPOSITO VELEZ JUAN CARLOS,ALMEYDA  NICOLAS,,TERMINADO POR LAUDO,RECURSO EXTRAORDINARIO,FALLO,DESFAVORABLE,PAGAR,0,INFRAESTRUCTURA,INSTITUTO NACIONAL DE VÍAS,Sector Transporte,"El Consejo de Estado en su Sala de lo Contencioso Administrativo Sección Tercera- Subsección A, en sus consideraciones destaca que con los fines de unificación de su jurisprudencia con apoyo en las normas legales correspondientes, concluyó que las controversias dirimidas en sede arbitral cuyos procesos hubieren iniciado con anterioridad a la vigencia de la ley 1563 de 2012, es decir en vigor del Decreto 1818 de 1998, deben continuar rigiéndose por esta última normatividad y por consiguiente, a los recursos de anulación interpuestos contra laudos provenientes de esa clase de procesos, aunque sean formulados en vigencia del nuevo estatuto de arbitramento, no les resulta aplicable la ley 1563. los procesos arbitrales en curso a la entrada en vigencia de esta ley seguirán rigiéndose asta su culminación por las normas anteriores, los procesos arbitrales iniciados con antelación a 12 de octubre de 2012 seguirán rigiéndose por las normas procesales que sobre la materia prescribe el Decreto Compilatorio 1818 de 1998, lo que incluye, entonces, el régimen de oportunidad, interposición, trámite y causales del recurso de anulación de laudo arbitral y, en sentido contrario, sólo se aplicará la normatividad del Estatuto de Arbitraje Nacional e Internacional para las demandas arbitrales interpuestas después del 12 de octubre de 2012."
210,487,14928763373.8024,749,DOLARES,3731519.17,ACERO DE COLOMBIA SAS NIT 8600555584,ACERO DE COLOMBIA SAS NIT 8600555584,REFINERIA DE CARTAGENA S.A.,48742166001-PO-00004110012012-420,487,28,420.0,0,NO,20154051486952 / 20164051134012 / 20164051227392 / 20164051576072 / 20164051881082 / 20164052069372/ 20174050491152/ 20174050491202/ 20174050491212/ 20174050491222/ 20174050491272/ 20174050491302/ 20181031705872 / 20198000040832,JURIDICO ,SI,,,NO,NEIRA PINEDA JUAN CAMILO,REFINERIA DE CARTAGENA S.A.|487|MINAS Y ENERGIA,900112515-7,NACIONAL,CONVOCANTE,ARBITRAMENTO GENERAL,4317,"CENTRO DE ARBITRAJE, CONCILIACIÓN Y AMIGABLE COMPOSICIÓN DE LA CÁMARA DE COMERCIO DE BOGOTÁ",MUTUO ACUERDO,1.0,VARON PALOMINO JUAN CARLOS,ROJAS IZAQUITA SONIA ELIZABETH,46666210,TERMINADO POR LAUDO,RECURSO EXTRAORDINARIO,FALLO,DESFAVORABLE,NO HAY CONDENA,159485410.71,GENERAL,REFINERÍA DE CARTAGENA S.A.S,Sector Minas y Energía,"El día 31 de agosto de 2012, REFICAR y ACERAL aceptaron la OFERTA MERCANTIL IRREVOCABLE cuyo objeto era el suministro de unos bienes, la controversia incurrió en incumplimiento de las obligaciones contenidas porque entregó unos bienes deferentes del contrato inicial, como Liberty seguros era la aseguradora del contrato, se demanda también a pagar conjuntamente con ACERAL los perjuicios. "
211,356,19907681207.806416,751,PESOS,16350934197.0,FUNDACIÓN MEDICO PREVENTIVA PARA EL BIENESTAR SOCIAL S.A. NIT 800050068-6,FONDO DE PRESTACIONES SOCIALES DEL MAGISTERIO - FOMAG,FUNDACIÓN MEDICO PREVENTIVA PARA EL BIENESTAR SOCIAL S.A. NIT 800050068-6,3561122-16-082008-440,356,53,440.0,1,NO,20154051739632 / 20164051551792 / 20164051551882 / 20168002063032/ 20178000759912/ 20178000860162/ 20178001480232/ 20178001563142/ 20178001563192/ 20178001572212/ 20178001751272/ 20178001854092/ 20178001870852/ 20178001870792/ 20178001999852/ 20178002095432/ 20178002107432/ 20178002138682/ 20178002253982/ 20178002340452,JURIDICO,NO,JURIDICA ,HERNANDEZ ORTIZ OSWALDO FRANCISCO,SI,VEGA PRECIADO HENRY,FONDO DE PRESTACIONES SOCIALES DEL MAGISTERIOS FOMAG|356|EDUCACION ,860525148-5,NACIONAL,CONVOCADO,ARBITRAMENTO GENERAL,4389,"CENTRO DE ARBITRAJE, CONCILIACIÓN Y AMIGABLE COMPOSICIÓN DE LA CÁMARA DE COMERCIO DE BOGOTÁ",MUTUO ACUERDO,3.0,VARON PALOMINO JUAN CARLOS,RUGELES MARTINEZ MONICA FERNANDA,52256686,TERMINADO POR LAUDO,PRIMERA ,FALLO,FAVORABLE,NO HAY CONDENA,189235000,GENERAL,FONDO DE PRESTACIONES SOCIALES DEL MAGISTERIO,Sector Educación Nacional,"Se declare que durante la ejecución del contrato para la prestación de servicios  medico-asistenciales No 1122-16-08 se presento insuficiencia integral en el valor de la unidad de pago por capacitación del magisterio (UPCM), es decir, los ingresos por este concepto fueron inferiores a los gastos incurridos por la demandante necesarios para atender y financiar el plan de atención en salud del magisterio o plan de beneficios, pactado en dicho contrato, insuficiencia que se presento en los años 2008, 2009, 2010, 2011 y hasta 30-04-2012 fecha de terminación del contrato, desencadenando en un desequilibrio económico del contrato "
